channel_id,derivative_channel,exact_identity,zero_condition,mapped_P8_component,mapped_symbol,affected_rows,current_evidence,evidence_required,minimum_fill_artifact,cancellation_policy,current_decision,valid_for_Newton_claim,valid_for_local_GR_claim,notes
CGM0_master_identity,"any channel X in {t,r,A,lambda,frame,domain}",epsilon_mu := mu_extra/(G_eff M_eff); mu_obs = G_eff M_eff(1+epsilon_mu); D_X ln mu_obs = D_X ln G_eff + D_X ln M_eff + D_X ln(1+epsilon_mu),"D_X ln G_eff = 0, D_X ln M_eff = 0, and D_X epsilon_mu = 0, or their cancellation is a parent-derived identity",all_P8_source_normalization_rows,D_X_ln_mu_obs,R1;R4;R9;R10;R11,exact algebraic identity derived from the existing mu_obs decomposition,"for a pass, each derivative channel must be theorem-zero or numerically filled below its lock",this gate plus one channel-specific residual/theorem artifact per active derivative channel,not allowed as a tuning; only a Ward/superselection/source identity may cancel terms for claim credit,derived_identity_only_no_zero_claim,false,false,this is the useful law; it converts vague measured-GM language into a row-by-row derivative scorecard
CGM1_time_drift,D_t,d ln mu_obs/dt = d ln G_eff/dt + d ln M_eff/dt + d ln(1+epsilon_mu)/dt,"dln_Geff_dt = 0; dln_Meff_dt = 0; partial_t epsilon_mu = 0, or parent-owned exact cancellation",P8_Geff_time_drift;P8_Meff_conservation;P8_boundary_bulk_domain_mu_extra,dln_Geff_dt;dln_Meff_dt;partial_t_epsilon_mu,R4;R9;R11,461 retains dln_Geff_dt and dln_Meff_dt unfilled; 462 leaves Delta_flux/Delta_G/Delta_extra active,"parent superselection plus calibrated Pi_M flux conservation, or numeric local drift residual",P8_time_drift_residual_or_zero.csv with units yr^-1 and separate G_eff/M_eff/mu_extra terms,"time cancellation must be an identity, not a fitted epoch-by-epoch balance",retained_unfilled_no_claim,false,false,this is the local Gdot lock; cosmology memory activity cannot be imported as local drift silence
CGM2_radial_hair,D_r,partial_r ln mu_obs = partial_r ln G_eff + partial_r ln M_eff + partial_r ln(1+epsilon_mu),"no radial G_eff profile, no radial M_eff leakage, and no radial mu_extra outside compact support",P8_radial_source_hair;P8_boundary_bulk_domain_mu_extra;P8_range_dependence,partial_r_ln_mu_obs;partial_r_epsilon_mu;alpha(lambda),R4;R10;R11,461 retains partial_r_ln_mu_obs unfilled; 434 identifies radial mu_extra as a failure channel,Gauss/no-hair theorem or radial profile envelope relative to measured GM,P8_radial_mu_profile_or_zero.csv with radius units and bound source,"radial cancellation must hold for every exterior radius, not only at an orbital calibration point",retained_unfilled_no_claim,false,false,"if this survives, Newton becomes range/radius-dependent rather than clean inverse-square source normalization"
CGM3_species_source_charge,D_A or Delta_AB across source/test species,Delta_AB ln mu_obs = Delta_AB ln G_eff + Delta_AB ln M_eff + Delta_AB ln(1+epsilon_mu),source action is selector-blind and mu_obs is composition/species independent,P8_species_source_charge;P8_frame_calibration_split,eta_source_AB;partial_A_ln_mu_obs,R1;R11,461 separates source-charge WEP from direct coframe WEP and retains eta_source_AB unfilled,no-species source-charge theorem or eta_source_AB residual below the source lock,P8_species_source_charge_residual_or_zero.csv with material/source assumptions,"species cancellation must be universal over allowed sources, not tuned per material",retained_unfilled_no_claim,false,false,direct WEP geometry is helpful but does not alone prove source-current universality
CGM4_range_dependence,D_lambda or finite-range branch scan,D_lambda ln mu_obs = D_lambda ln G_eff + D_lambda ln M_eff + D_lambda ln(1+epsilon_mu); a nonzero finite-range term maps to alpha(lambda),"alpha(lambda)=0 by theorem, or an executable alpha(lambda) curve stays below bounds for every relevant lambda",P8_range_dependence;R11_EH_operator_ledger,alpha(lambda);D_lambda_ln_mu_obs,R10;R11,461 and 464 both mark the R10 alpha(lambda) link required but missing,no-range theorem or R10 alpha(lambda) curve with predicted and bound columns,R10_alpha_lambda_curve_MTS_source_normalization.csv or theorem-zero source path,"range cancellation must be functional in lambda, not a single-scale calibration",retained_unfilled_no_claim,false,false,symbolic fifth-force silence is not enough; this row needs a curve or a proof
CGM5_frame_domain_split,Delta_frame or D_domain,Delta_frame ln mu_obs = Delta_frame ln G_eff + Delta_frame ln M_eff + Delta_frame ln(1+epsilon_mu),one observed coframe/source frame/domain readout is parent-selected for source variation and matter motion,P8_frame_calibration_split,delta_frame_source,R0;R2;R11,461 reports only partial conditional same-frame evidence; source variation remains not parent-derived,parent frame theorem or frame/source calibration residual below WEP and clock locks,P8_frame_source_split_residual_or_zero.csv with same-frame assumptions,"frame cancellation must be a single parent pullback, not post-hoc coordinate relabeling",retained_unfilled_no_claim,false,false,"this keeps the source-side frame issue attached to the variational source, not just the geodesic readout"
CGM6_mu_extra_amplitude,epsilon_mu amplitude and all D_X epsilon_mu,epsilon_mu = mu_extra/(G_eff M_eff); D_X ln(1+epsilon_mu) = (D_X epsilon_mu)/(1+epsilon_mu),"epsilon_mu = 0, or epsilon_mu is a universal constant calibration and every derivative D_X epsilon_mu vanishes",P8_boundary_bulk_domain_mu_extra;R11_EH_operator_ledger,mu_extra_boundary_bulk_domain/(G_eff M_eff);D_X_epsilon_mu,R3;R4;R7;R8;R9;R11,434 decomposes mu_extra channels; 461 retains the central mu_extra row unfilled; 464 leaves source_normalization_operator unfilled,"mu_extra=0 theorem or coefficient/residual map for every boundary, bulk, domain, memory, and non-EH channel",P8_mu_extra_over_Geff_Meff_vector.csv with channel coefficients and derivative tags,constant universal calibration may be absorbed; radial/time/species/range/frame variation may not,retained_unfilled_no_claim,false,false,"this is the main hair vector: even if its amplitude is tiny, it must be sourced or bounded"
CGM7_second_order_beta_residue,second-order source-normalized weak field,"after first-order mu_obs is fixed, delta_beta_source is the remaining U^2 source-normalization residue",delta_beta_source=0 and gamma-1=0 after measured-GM normalization,P8_nonlinear_beta_source_residue;R11_EH_operator_ledger,delta_beta_source;beta_minus_1;gamma_minus_1,R3;R4;R11,461 marks beta residue not required for first-order only but blocking for local-GR promotion,second-order weak-field theorem-zero or numeric PPN residual vector after constant-GM rows are owned,P8_second_order_source_normalized_PPN_vector.csv,beta cancellation cannot be inferred from first-order Poisson/Gauss,deferred_until_first_order_source_rows_owned,not_required_for_first_order_only,false,kept in the gate so nobody accidentally upgrades Newton to GR on first-order evidence
