fork_id,route,what_it_buys,what_still_missing,decision
F0_double_zero_parent_clause,"accept only a scalar auxiliary selector with chi_D^2 memory activation and topological P_MTS,D",formal local no-vector/no-flux/no-anisotropy theorem if local zero and R11 silence are also parent-derived,"origin of chi_D^2 coupling, local spectral/trivial-class theorem, topological projector ownership, R11 coefficients",best_theory_route_but_not_promoted
F1_linear_selector,allow S_mem proportional chi_D,simpler activation,"lambda_D need not vanish at chi_D=0, so hidden selector stress can survive",reject_for_local_GR_branch_unless_bound
F2_dynamic_selector,give chi_D a kinetic term or smooth domain-wall field,standard variational scalar dynamics,"new scalar force, length scale, and PPN residuals",coefficient_branch_only
F3_external_window,choose chi_D or P_D after solving,easy phenomenology,variational Ward ownership,forbidden_as_field_theory_derivation
F4_numeric_coefficients,"retain W_domain_alpha1, W_domain_alpha2, W_domain_alpha3, W_domain_xi, and c_domain_source_normalization_operator",testable closure branch without pretending derivation,actual values or theorem-zero sources,required_fallback
