premise_id,needed_for_zero,current_evidence,owner_status,blocks_claim,repair_route
P0_metric_independent_topological_projector,P_D has no local bulk metric variation,348 conditional theorem,conditional_not_parent_owned,true,derive P_D from parent relative-chain/cohomology variables rather than choose a filter
P1_not_Hodge_or_external_projector,projector is not metric-dependent and not inserted after solving,348/356 reject Hodge/orthogonal and external projectors,policy_pass_not_positive_derivation,true,write explicit allowed projector construction
P2_domain_selector_no_vector,domain selector carries no preferred local vector/frame/normal flow,143 selector not derived; 429 covariant_domain_vector counterexample,not_derived,true,derive stationary scalar domain selector or retain vector coefficient
P3_local_trivial_representative,local compact branch has exact/trivial domain class and no coherent active domain memory,309 exact/no-flux local currents are conditional,conditional,true,prove local representative theorem from parent action
P4_Bianchi_stress_retained,"all projector/domain/boundary stresses are varied, retained, or theorem-zero",207/235/356 insist no dropped stress,structural_policy_only,true,supply stress ledger or zero theorem for every retained term
P5_R11_operator_vector,retained operator/domain coefficients are executable and zero/bounded,468 required R11_nonEH_operator_vector_executable.csv for domain,missing,true,build R11 domain operator vector minimum artifact
