decision_id,status,meaning,next_action
D0_parent_clause,sufficient_clause_written_not_derived,a scalar auxiliary selector with chi_D^2 memory activation can formally kill local selector stress/vector leakage if its local-zero premises hold,derive the origin of the double-zero memory coupling
D1_no_vector,not_promoted,no-vector follows only if Sigma_D is scalar/topological and local branch has Sigma_D=0 by parent theorem,derive projected local gap or relative triviality
D2_coefficients,retained,R5/R6/R7/R8/R11 products remain the honest fallback,fill numeric products or theorem-zero sources before any score
D3_R11,still_blocking,domain source-normalization operator has zero claim-valid R11 rows,R11 domain source-normalization zero-or-fill after double-zero origin
D4_promotion,forbidden,"no domain channel, PPN, Newtonian-limit, or local-GR pass is earned",476-double-zero-memory-coupling-origin-or-coefficient-runner.md
