source_file,exists,role
429-Ward-Bianchi-exchange-owner-for-Poisson-source.md,True,Ward/Bianchi identity shows owned hidden flux is not automatically zero
435-exterior-extra-source-nohair-owner-gate.md,True,exterior no-hair owner gate keeps alpha3 boundary/projector rows retained
467-mu-extra-zero-owner-or-source-normalization-coefficient-vector.md,True,eight-channel mu_extra coefficient vector and owner ledger
468-mu-extra-coefficient-vector-to-local-bound-scorecard.md,True,local-bound scorecard identifying R7_alpha3 as the tightest pressure row
source-intake\mts_residuals\P8_MU_EXTRA_LOCAL_BOUND_SCORECARD.csv,True,machine-readable alpha3 rows and pass locks
source-intake\mts_residuals\P8_MU_EXTRA_CHANNEL_BOUND_SUMMARY.csv,True,channel summary showing boundary and domain tied at 4e-20
source-intake\mts_residuals\P8_MU_EXTRA_SCORECARD_REQUIRED_INPUTS.csv,True,required input priorities for boundary and domain coefficient artifacts
