contract_id,required_identity,mathematical_form,closes_component,affected_rows,current_status,evidence_needed,fallback_if_missing
MF0_parent_projector_origin,Pi_M is derived from parent cohomology/symplectic/source identity before readout,Pi_M: J_H -> H^2_abs(Sigma_ext) mass-flux class,projector not fitted/readout-defined,R0;R1;R4;R11,candidate_origin_not_completed,explicit symplectic metric/projector algebra and variation,mass projector remains closure-only
MF1_source_current_input,projected current is the Hilbert/Ward matter source from the same observed coframe,J_H from delta S_m/delta e_obs,ordinary source-current input,R1;R4;R11,conditional_from_449,one observed coframe and source-current Ward theorem,source current remains fitted/readout-defined
MF2_Euler_flux_closure,parent Euler equation or Ward source identity closes the projected mass current,E_lambdaM=0 or Ward_M => d(Pi_M J_H)=0,P8_Meff_conservation,R4;R7;R9;R11,conditional_not_parent_derived,derive the lambda_M/Pi_M Euler equation or separate mass Ward identity,M_eff drift/source-flux residual row
MF3_no_ad_hoc_multiplier,closure constraint has independent parent reason and is not added solely to force GM success,lambda_M is gauge/topological/Ward/symplectic-owned,no-cheat closure rule,R1;R4;R9;R11,not_satisfied,independent origin for lambda_M and source-normalization constraint,closure counted as assumption only
MF4_radial_conservation,closed projected flux makes M_eff radially constant over exterior annuli,M_eff(r2)-M_eff(r1)=int_{S2xI} d(Pi_M J_H)=0,P8_radial_source_hair if no boundary/range terms,R3;R4;R10;R11,conditional_from_244,MF2 plus no boundary/range/domain source terms,radial source hair remains active
MF5_absolute_calibration,M_eff normalization equals the orbital/asymptotic measured monopole,M_eff=(4 pi G_ref)^-1 int_S2 Pi_M J_H and mu_obs=G_eff M_eff,measured-GM normalization,R1;R4;R9;R10;R11,not_parent_derived,EH/Poisson/asymptotic matching and parent-selected G_ref,closed mass flux is not measured Newtonian mass
MF6_zero_boundary_and_nonHilbert_flux,"no owned boundary, bulk, domain, memory, range, or connection flux shifts the monopole",mu_extra=0 or retained with units and row locks,P8_boundary_bulk_domain_mu_extra,R3;R4;R7;R8;R9;R10;R11,not_parent_derived,"K_owner formula, zero-flux theorem, no-hair theorem, or executable residuals",P8 residual vector blocks Newton claim
MF7_constant_universal_coupling_needed,G_eff/kappa_eff does not carry time/range/species/frame dependence,"partial_{t,r,A,lambda}G_eff=0",Gdot/source/fifth-force calibration drift,R1;R4;R9;R10;R11,not_parent_derived,constant universal Geff/kappa identity,next target remains active; no Newton/local-GR claim
MF8_retained_residual_fallback,any failed mass-flux condition becomes executable residual data,"dln_Meff_dt, partial_r ln mu_obs, mu_extra/(GM), eta_source, alpha(lambda)",none; retained branch only,R1;R3;R4;R7;R8;R9;R10;R11,template_policy_only,numeric residual coefficient/curve or theorem-zero,no measured-GM/Newton/PPN/local-GR claim
